{
  "$schema": "../schemas/curriculum.schema.json",
  "manifestVersion": 1,
  "institutionCode": "CWIT",
  "departmentCode": "CIOT",
  "programmeCode": "DCIOT",
  "officialProgrammeCode": "CI",
  "schemeCode": "R23",
  "schemeRevision": "MPECS 2023",
  "semesterNumber": 3,
  "status": "draft",
  "verificationStatus": "structure_verified",
  "sourceReferences": [
    {
      "sourceId": "ciot-r23-curriculum",
      "title": "Computer Engineering and IoT R23 Curriculum",
      "sourceUrl": "https://cwit.mespune.org/wp-content/uploads/2023/07/IOTR23_ALL_Curriculam-FINALV.pdf",
      "localPath": "content-import/official/CIOT_R23_curriculum.pdf",
      "evidence": "Official Semester 3 learning and assessment scheme table and curriculum index for Diploma in Computer Engineering and IoT."
    }
  ],
  "manifestNotes": [
    "Subject rows are structure verified from the official R23 curriculum PDF.",
    "Units, topics, outcomes and practical experiments are intentionally empty until parsed from the official curriculum PDF."
  ],
  "subjects": [
    {
      "order": 1,
      "officialSubjectCode": "R23CI2602",
      "name": "Data Structures",
      "category": "DSC",
      "credits": 4,
      "assessment": {
        "totalMarks": 175
      },
      "units": [
        {
          "order": 1,
          "title": "Introduction to Data Structures",
          "topics": [],
          "sourceReferences": [
            {
              "sourceId": "ciot-r23-curriculum",
              "pages": [
                129,
                130,
                131,
                132,
                133,
                134
              ]
            }
          ],
          "verificationStatus": "structure_verified",
          "notes": "Promoted from official course content extraction; topics remain pending review."
        },
        {
          "order": 2,
          "title": "Searching and Sorting",
          "topics": [],
          "sourceReferences": [
            {
              "sourceId": "ciot-r23-curriculum",
              "pages": [
                129,
                130,
                131,
                132,
                133,
                134
              ]
            }
          ],
          "verificationStatus": "structure_verified",
          "notes": "Promoted from official course content extraction; topics remain pending review."
        },
        {
          "order": 3,
          "title": "Linked List",
          "topics": [],
          "sourceReferences": [
            {
              "sourceId": "ciot-r23-curriculum",
              "pages": [
                129,
                130,
                131,
                132,
                133,
                134
              ]
            }
          ],
          "verificationStatus": "structure_verified",
          "notes": "Promoted from official course content extraction; topics remain pending review."
        },
        {
          "order": 4,
          "title": "Stack",
          "topics": [],
          "sourceReferences": [
            {
              "sourceId": "ciot-r23-curriculum",
              "pages": [
                129,
                130,
                131,
                132,
                133,
                134
              ]
            }
          ],
          "verificationStatus": "structure_verified",
          "notes": "Promoted from official course content extraction; topics remain pending review."
        },
        {
          "order": 5,
          "title": "Queue",
          "topics": [],
          "sourceReferences": [
            {
              "sourceId": "ciot-r23-curriculum",
              "pages": [
                129,
                130,
                131,
                132,
                133,
                134
              ]
            }
          ],
          "verificationStatus": "structure_verified",
          "notes": "Promoted from official course content extraction; topics remain pending review."
        },
        {
          "order": 6,
          "title": "Tree",
          "topics": [],
          "sourceReferences": [
            {
              "sourceId": "ciot-r23-curriculum",
              "pages": [
                129,
                130,
                131,
                132,
                133,
                134
              ]
            }
          ],
          "verificationStatus": "structure_verified",
          "notes": "Promoted from official course content extraction; topics remain pending review."
        }
      ],
      "outcomes": [
        {
          "order": 1,
          "code": "CO1",
          "text": "Perform basic operations on Arrays.",
          "sourceReferences": [
            {
              "sourceId": "ciot-r23-curriculum",
              "pages": [
                129,
                130,
                131,
                132,
                133,
                134
              ]
            }
          ],
          "verificationStatus": "content_verified"
        },
        {
          "order": 2,
          "code": "CO2",
          "text": "Apply different Searching and sorting methods.",
          "sourceReferences": [
            {
              "sourceId": "ciot-r23-curriculum",
              "pages": [
                129,
                130,
                131,
                132,
                133,
                134
              ]
            }
          ],
          "verificationStatus": "content_verified"
        },
        {
          "order": 3,
          "code": "CO3",
          "text": "Implement basic operations on Linked List.",
          "sourceReferences": [
            {
              "sourceId": "ciot-r23-curriculum",
              "pages": [
                129,
                130,
                131,
                132,
                133,
                134
              ]
            }
          ],
          "verificationStatus": "content_verified"
        },
        {
          "order": 4,
          "code": "CO4",
          "text": "Perform operations on Stack using Array and Linked List Implementations.",
          "sourceReferences": [
            {
              "sourceId": "ciot-r23-curriculum",
              "pages": [
                129,
                130,
                131,
                132,
                133,
                134
              ]
            }
          ],
          "verificationStatus": "content_verified"
        },
        {
          "order": 5,
          "code": "CO5",
          "text": "Perform operations on Queue using Array and Linked List Implementations.",
          "sourceReferences": [
            {
              "sourceId": "ciot-r23-curriculum",
              "pages": [
                129,
                130,
                131,
                132,
                133,
                134
              ]
            }
          ],
          "verificationStatus": "content_verified"
        },
        {
          "order": 6,
          "code": "CO6",
          "text": "Create and Traverse Tree to solve problems. C)",
          "sourceReferences": [
            {
              "sourceId": "ciot-r23-curriculum",
              "pages": [
                129,
                130,
                131,
                132,
                133,
                134
              ]
            }
          ],
          "verificationStatus": "content_verified"
        }
      ],
      "practicalExperiments": [],
      "sourceReferences": [
        {
          "sourceId": "ciot-r23-curriculum",
          "pages": [
            128,
            129,
            130,
            131,
            132,
            133
          ]
        }
      ],
      "verificationStatus": "structure_verified"
    },
    {
      "order": 2,
      "officialSubjectCode": "R23CI6604",
      "name": "Object Oriented Programming With C++",
      "category": "SEC",
      "credits": 3,
      "assessment": {
        "totalMarks": 175
      },
      "units": [
        {
          "order": 1,
          "title": "Principles of Object",
          "topics": [],
          "sourceReferences": [
            {
              "sourceId": "ciot-r23-curriculum",
              "pages": [
                101,
                102,
                103,
                104,
                105,
                106,
                107
              ]
            }
          ],
          "verificationStatus": "structure_verified",
          "notes": "Promoted from official course content extraction; topics remain pending review."
        }
      ],
      "outcomes": [
        {
          "order": 1,
          "code": "CO1",
          "text": "Understand basic concepts of OOP languages - tokens, Operators, Expressions and Control Structures in C++.",
          "sourceReferences": [
            {
              "sourceId": "ciot-r23-curriculum",
              "pages": [
                101,
                102,
                103,
                104,
                105,
                106,
                107
              ]
            }
          ],
          "verificationStatus": "content_verified"
        },
        {
          "order": 2,
          "code": "CO2",
          "text": "Define class, objects, use of static variables , friend functions.",
          "sourceReferences": [
            {
              "sourceId": "ciot-r23-curriculum",
              "pages": [
                101,
                102,
                103,
                104,
                105,
                106,
                107
              ]
            }
          ],
          "verificationStatus": "content_verified"
        },
        {
          "order": 3,
          "code": "CO3",
          "text": "Develop C++ programs using constructors and destructors.",
          "sourceReferences": [
            {
              "sourceId": "ciot-r23-curriculum",
              "pages": [
                101,